{
  "name": "epd-skills",
  "version": "0.2.0",
  "publisher": "EPD Commerce",
  "homepage": "https://docs.api.epd.com/",
  "repository": "https://github.com/EPDCommerce/agent-skills",
  "license": "MIT",
  "api_version": "2026-02-11",
  "skills": [
    {
      "name": "epd-best-practices",
      "kind": "integration",
      "description": "Integrating EPD Commerce via the v1 REST API — auth, idempotency, error envelope, pagination, payments, subscriptions, refunds, security, versioning. Routes to per-domain references for detail.",
      "files": [
        "integration/epd-best-practices/SKILL.md",
        "integration/epd-best-practices/references/sdk-wrapper.md",
        "integration/epd-best-practices/references/payments.md",
        "integration/epd-best-practices/references/subscriptions.md",
        "integration/epd-best-practices/references/refunds.md",
        "integration/epd-best-practices/references/errors.md",
        "integration/epd-best-practices/references/debugging.md",
        "integration/epd-best-practices/references/security.md",
        "integration/epd-best-practices/references/testing.md",
        "integration/epd-best-practices/references/versioning.md"
      ]
    },
    {
      "name": "epd-webhooks",
      "kind": "integration",
      "description": "Configuring, verifying, and debugging EPD Commerce webhook endpoints — HMAC-SHA256 signatures, replay protection, version upgrades, delivery log inspection. Includes Node, Python, and PHP verifier scripts.",
      "files": [
        "integration/epd-webhooks/SKILL.md",
        "integration/epd-webhooks/references/debugging.md",
        "integration/epd-webhooks/scripts/verify_node.js",
        "integration/epd-webhooks/scripts/verify_python.py",
        "integration/epd-webhooks/scripts/verify_php.php"
      ]
    },
    {
      "name": "epd-quickstart",
      "kind": "integration",
      "description": "First-time EPD Commerce integration — sandbox API key, customer/payment-method/product creation, first test charge, decline path validation.",
      "files": [
        "integration/epd-quickstart/SKILL.md"
      ]
    },
    {
      "name": "epd-mcp-operator",
      "kind": "workflow",
      "description": "Cross-cutting safety layer and router for the EPD Commerce MCP surface: tool selection, confirmation tiers, test-vs-live mode, idempotency, rate limiting, error envelopes, and permission errors. The workflow counterpart to epd-best-practices.",
      "files": [
        "workflows/epd-mcp-operator/SKILL.md",
        "workflows/epd-mcp-operator/references/tiers.md",
        "workflows/epd-mcp-operator/references/errors.md",
        "workflows/epd-mcp-operator/references/composites.md"
      ]
    },
    {
      "name": "epd-onboard-customer",
      "kind": "workflow",
      "description": "Customer lifecycle over the EPD Commerce MCP server: create, look up, update and delete customers, attach and remove cards, and the two browser-only composites that bundle signup with a first charge or subscription. References MCP tool names, not REST endpoints.",
      "files": [
        "workflows/epd-onboard-customer/SKILL.md"
      ]
    },
    {
      "name": "epd-subscriptions",
      "kind": "workflow",
      "description": "Operator-agent workflow over the EPD Commerce MCP server: start subscriptions on existing customers, change payment method or billing cycle, cancel, and recover a failed renewal through the dunning loop without charging twice.",
      "files": [
        "workflows/epd-subscriptions/SKILL.md"
      ]
    },
    {
      "name": "epd-webhook-ops",
      "kind": "workflow",
      "description": "Operating webhook endpoints on a live EPD Commerce account: registration, secret rotation with its 24-hour overlap window, delivery-log inspection, event replay, and schema version migration.",
      "files": [
        "workflows/epd-webhook-ops/SKILL.md"
      ]
    },
    {
      "name": "epd-transaction-triage",
      "kind": "workflow",
      "description": "Read-only diagnosis of a failed EPD Commerce charge: sorts a decline into safe-to-retry, never-retry, or needs-a-human, and hands off the retry rather than performing it.",
      "files": [
        "workflows/epd-transaction-triage/SKILL.md"
      ]
    },
    {
      "name": "epd-catalog",
      "kind": "workflow",
      "description": "Products, plans and one-off orders over the EPD Commerce MCP server: catalog setup, product images, plan lookup, and the line-item and shipping-address constraints that reject an order.",
      "files": [
        "workflows/epd-catalog/SKILL.md"
      ]
    },
    {
      "name": "epd-coupons",
      "kind": "workflow",
      "description": "Discounts end to end over the EPD Commerce MCP server: creating promo and generated coupons, minting code batches, validating a code before use, and archiving or restoring a coupon, where restoring takes two calls.",
      "files": [
        "workflows/epd-coupons/SKILL.md"
      ]
    },
    {
      "name": "epd-reporting",
      "kind": "workflow",
      "description": "Read-only reporting over the EPD Commerce MCP server: revenue totals for a period, per-customer financial history, and month-end reconciliation against the transaction list. Reaches no write tool.",
      "files": [
        "workflows/epd-reporting/SKILL.md"
      ]
    },
    {
      "name": "epd-refunds",
      "kind": "workflow",
      "description": "Operator-agent workflow over the EPD Commerce MCP server: decision tree across refund_order, refund_transaction, and refund_and_cancel.",
      "files": [
        "workflows/epd-refunds/SKILL.md"
      ]
    }
  ]
}
